{
  "schema_version": 1,
  "slice": "content-production",
  "updated_at": "2026-08-01T18:15:05+08:00",
  "processing_contract": {
    "raw_background": "#ff00ff",
    "normalized_source_size": [
      1280,
      1280
    ],
    "grid": [
      5,
      5
    ],
    "action_cells": 20,
    "directions_per_action_cell": 4,
    "direction_order": [
      "north",
      "east",
      "south",
      "west"
    ],
    "model_native_seed_exposure": "not_exposed_by_builtin_image_gen"
  },
  "attempts": [
    {
      "attempt_id": "slice_monster_00-attempt-001",
      "unit_id": "unit.slice_monster_00",
      "status": "adopted",
      "generation": {
        "mode": "built-in-imagegen",
        "independent_call": true,
        "prompt": "Independent built-in ImageGen attempt for unit.slice_monster_00. Original-only brief: Low root-tusk boar made of twisted hardwood and lichen, shovel-like ivory tusks, knotted shoulder hump and muddy fern palette. Exact 5x5 sheet; 20 ordered action cells; each cell four complete N/E/S/W subjects; row 5 portrait/material/glyph/turnaround/palette; flat #ff00ff; no copied identity.",
        "prompt_capture": "normalized-from-tool-invocation-template",
        "imagegen_output_id": "exec-1b30ee8b-369a-41ea-bb05-92fa7332dbf4",
        "call_id": null,
        "call_id_exposure": "not exposed by built-in ImageGen",
        "model_native_seed": "not_exposed_by_builtin_image_gen"
      },
      "raw_source": {
        "path": "assets/production/attempts/slice_monster_00/attempt-001/raw.png",
        "sha256": "b89171f7ed1aad175d80d1ecfe22385e7b563dd3264ce518312b8407568bbd25",
        "width": 1254,
        "height": 1254
      },
      "mechanical_gate": {
        "status": "passed",
        "min_direction_quadrant_pixels": 644,
        "failures": []
      },
      "review": {
        "reviewer": "claude:independent-t18a-reviewer",
        "decision": "adopted",
        "reviewed_at": "2026-08-01T17:14:06+08:00",
        "review_record_sha256": "8f184279232c989c3697db289ef94cf5959fa1d72e74bfb8c4dc52c557ba1ec0",
        "reason": "Adopted by the aggregate T18A review; no rejection recorded."
      }
    },
    {
      "attempt_id": "slice_monster_01-attempt-001",
      "unit_id": "unit.slice_monster_01",
      "status": "adopted",
      "generation": {
        "mode": "built-in-imagegen",
        "independent_call": true,
        "prompt": "Independent built-in ImageGen attempt for unit.slice_monster_01. Original-only brief: Wide pitcher-plant crab with seed-spitting trumpet claw, leaf-shell carapace, thin vine legs and lime, burgundy and tan materials. Exact 5x5 sheet; 20 ordered action cells; each cell four complete N/E/S/W subjects; row 5 portrait/material/glyph/turnaround/palette; flat #ff00ff; no copied identity.",
        "prompt_capture": "normalized-from-tool-invocation-template",
        "imagegen_output_id": "exec-d0c58a9e-dcc8-44b8-beae-7ab0b15eb835",
        "call_id": null,
        "call_id_exposure": "not exposed by built-in ImageGen",
        "model_native_seed": "not_exposed_by_builtin_image_gen"
      },
      "raw_source": {
        "path": "assets/production/attempts/slice_monster_01/attempt-001/raw.png",
        "sha256": "02f2351d0108e2251852a3f7f0cd869485ed6b3c4e79954381388d5aadd17faf",
        "width": 1254,
        "height": 1254
      },
      "mechanical_gate": {
        "status": "passed",
        "min_direction_quadrant_pixels": 770,
        "failures": []
      },
      "review": {
        "reviewer": "claude:independent-t18a-reviewer",
        "decision": "adopted",
        "reviewed_at": "2026-08-01T17:14:06+08:00",
        "review_record_sha256": "8f184279232c989c3697db289ef94cf5959fa1d72e74bfb8c4dc52c557ba1ec0",
        "reason": "Adopted by the aggregate T18A review; no rejection recorded."
      }
    },
    {
      "attempt_id": "slice_monster_02-attempt-001",
      "unit_id": "unit.slice_monster_02",
      "status": "adopted",
      "generation": {
        "mode": "built-in-imagegen",
        "independent_call": true,
        "prompt": "Independent built-in ImageGen attempt for unit.slice_monster_02. Original-only brief: Floating prism jelly with faceted bell, three ribbon tentacles, internal rotating light core and translucent cyan-lilac glass body. Exact 5x5 sheet; 20 ordered action cells; each cell four complete N/E/S/W subjects; row 5 portrait/material/glyph/turnaround/palette; flat #ff00ff; no copied identity.",
        "prompt_capture": "normalized-from-tool-invocation-template",
        "imagegen_output_id": "exec-3be1bb5c-f922-4966-9c35-204c1b9fd8f2",
        "call_id": null,
        "call_id_exposure": "not exposed by built-in ImageGen",
        "model_native_seed": "not_exposed_by_builtin_image_gen"
      },
      "raw_source": {
        "path": "assets/production/attempts/slice_monster_02/attempt-001/raw.png",
        "sha256": "623b1fb5cd912143637aade4d3f956afeefbd4537200dcec1dfd005cd938a07c",
        "width": 1254,
        "height": 1254
      },
      "mechanical_gate": {
        "status": "passed",
        "min_direction_quadrant_pixels": 828,
        "failures": []
      },
      "review": {
        "reviewer": "claude:independent-t18a-reviewer",
        "decision": "adopted",
        "reviewed_at": "2026-08-01T17:14:06+08:00",
        "review_record_sha256": "8f184279232c989c3697db289ef94cf5959fa1d72e74bfb8c4dc52c557ba1ec0",
        "reason": "Adopted by the aggregate T18A review; no rejection recorded."
      }
    },
    {
      "attempt_id": "slice_monster_03-attempt-001",
      "unit_id": "unit.slice_monster_03",
      "status": "adopted",
      "generation": {
        "mode": "built-in-imagegen",
        "independent_call": true,
        "prompt": "Independent built-in ImageGen attempt for unit.slice_monster_03. Original-only brief: Compact molten armadillo with hexagonal basalt shell, glowing seam claws, wedge snout and black, orange and ash-grey surface. Exact 5x5 sheet; 20 ordered action cells; each cell four complete N/E/S/W subjects; row 5 portrait/material/glyph/turnaround/palette; flat #ff00ff; no copied identity.",
        "prompt_capture": "normalized-from-tool-invocation-template",
        "imagegen_output_id": "exec-bf955bc2-f21c-4727-9d8c-97a84638e992",
        "call_id": null,
        "call_id_exposure": "not exposed by built-in ImageGen",
        "model_native_seed": "not_exposed_by_builtin_image_gen"
      },
      "raw_source": {
        "path": "assets/production/attempts/slice_monster_03/attempt-001/raw.png",
        "sha256": "25b86549237c34b7750bee4db62f41c75ffd2f3ccd5d58d9d86ad29f473fab53",
        "width": 1254,
        "height": 1254
      },
      "mechanical_gate": {
        "status": "passed",
        "min_direction_quadrant_pixels": 275,
        "failures": []
      },
      "review": {
        "reviewer": "claude:independent-t18a-reviewer",
        "decision": "adopted",
        "reviewed_at": "2026-08-01T17:14:06+08:00",
        "review_record_sha256": "8f184279232c989c3697db289ef94cf5959fa1d72e74bfb8c4dc52c557ba1ec0",
        "reason": "Adopted by the aggregate T18A review; no rejection recorded."
      }
    },
    {
      "attempt_id": "slice_monster_04-attempt-001",
      "unit_id": "unit.slice_monster_04",
      "status": "adopted",
      "generation": {
        "mode": "built-in-imagegen",
        "independent_call": true,
        "prompt": "Independent built-in ImageGen attempt for unit.slice_monster_04. Original-only brief: Tall ice-quill owlbeast that fires crystalline pinions, diamond head silhouette, shaggy snow chest and pale blue slate feathers. Exact 5x5 sheet; 20 ordered action cells; each cell four complete N/E/S/W subjects; row 5 portrait/material/glyph/turnaround/palette; flat #ff00ff; no copied identity.",
        "prompt_capture": "normalized-from-tool-invocation-template",
        "imagegen_output_id": "exec-3f556ee9-8005-4f06-ae28-0696d244d33e",
        "call_id": null,
        "call_id_exposure": "not exposed by built-in ImageGen",
        "model_native_seed": "not_exposed_by_builtin_image_gen"
      },
      "raw_source": {
        "path": "assets/production/attempts/slice_monster_04/attempt-001/raw.png",
        "sha256": "aec50f8e517e54ada0d80ed0675813c28de2aab81d5f9d88ff091da2e4820e4b",
        "width": 1254,
        "height": 1254
      },
      "mechanical_gate": {
        "status": "passed",
        "min_direction_quadrant_pixels": 991,
        "failures": []
      },
      "review": {
        "reviewer": "claude:independent-t18a-reviewer",
        "decision": "adopted",
        "reviewed_at": "2026-08-01T17:14:06+08:00",
        "review_record_sha256": "8f184279232c989c3697db289ef94cf5959fa1d72e74bfb8c4dc52c557ba1ec0",
        "reason": "Adopted by the aggregate T18A review; no rejection recorded."
      }
    },
    {
      "attempt_id": "slice_monster_05-attempt-001",
      "unit_id": "unit.slice_monster_05",
      "status": "rejected",
      "generation": {
        "mode": "built-in-imagegen",
        "independent_call": true,
        "prompt": "Independent built-in ImageGen attempt for unit.slice_monster_05. Original-only brief: Long shadow candle slug with many wax tapers on its back, single violet flame eye, glossy ink body and dripping ivory wax. Exact 5x5 sheet; 20 ordered action cells; each cell four complete N/E/S/W subjects; row 5 portrait/material/glyph/turnaround/palette; flat #ff00ff; no copied identity.",
        "prompt_capture": "normalized-from-tool-invocation-template",
        "imagegen_output_id": "exec-9974ae21-f02c-433c-bbe4-741bc2b7dda0",
        "call_id": null,
        "call_id_exposure": "not exposed by built-in ImageGen",
        "model_native_seed": "not_exposed_by_builtin_image_gen"
      },
      "raw_source": {
        "path": "assets/production/attempts/slice_monster_05/attempt-001/raw.png",
        "sha256": "85542796706a331d090b4444ca6878ea57d64db509f95de45a01f0e49edf5b9e",
        "width": 1254,
        "height": 1254
      },